{
  "sponsor_id": "sponsor-001",
  "name": "Fictional Neighborhood Garden Center",
  "headline": "Helping local neighborhoods grow greener",
  "image_url": "https://example.org/sponsor-001.jpg",
  "alt_text": "Illustrated logo for a fictional garden center",
  "website_url": "https://example.org/sponsors/sponsor-001"
}
